{
  "$schema": "https://json-schema.org/draft/2020-12/schema",
  "title": "Storyboard",
  "type": "object",
  "required": ["title", "description", "tags", "hook", "scenes", "style_guide"],
  "additionalProperties": false,
  "properties": {
    "title": { "type": "string", "minLength": 1, "maxLength": 70 },
    "description": { "type": "string", "minLength": 1 },
    "tags": { "type": "array", "items": { "type": "string" }, "minItems": 1 },
    "hook": { "type": "string", "minLength": 1 },
    "style_guide": { "type": "string", "minLength": 1 },
    "scenes": {
      "type": "array",
      "minItems": 1,
      "items": {
        "type": "object",
        "required": ["n", "narration", "visual_prompt", "duration_s"],
        "additionalProperties": false,
        "properties": {
          "n": { "type": "integer", "minimum": 1 },
          "narration": { "type": "string", "minLength": 1 },
          "visual_prompt": { "type": "string", "minLength": 1 },
          "duration_s": { "type": "number", "exclusiveMinimum": 0 }
        }
      }
    }
  }
}
